,Odběratel,ID,IČO,Datum uzavření smlouvy,Cena_bez_dph,Cena_s_dph,Předmět smlouvy,zboží,ID verze,Dodavatel
230,CENTRUM SOCIÁLNÍCH A ZDRAVOTNÍCH SLUŽEB MĚSTA PŘÍBRAM,21550125,47067071,30.12.2022,"63 753,72 CZK","77 142,00 CZK",Objednávka lůžkovin,"[{'název': 'Podložka SONOMA 85x90 bez záhybů', 'množství': 23, 'cena bez DPH': '628 Kč', 'cena s DPH': '14.444,00 Kč'}, {'název': 'Bavlněné povlečení Planetárium šedé (hot. kapsa)', 'množství': 10, 'cena bez DPH': '557,30 Kč', 'cena s DPH': '5.573,00 Kč'}, {'název': 'Deka mikrofianel pistáciová', 'množství': 30, 'cena bez DPH': '521,10 Kč', 'cena s DPH': '15.633,00 Kč'}]",23126289,Apos Brno
231,"Domov Vesna, příspěvková organizace",21531069,75154391,27.12.2022,,"117 177,10 CZK","Objednávka - pomůcky pro klienty (podložky, prostěradla, košile, pásy)","[{'název': 'manipulační pás UNI', 'množství': 1, 'cena bez DPH': 1473.6, 'cena s dph': None}, {'název': 'člověče nezlob se XXL', 'množství': 1, 'cena bez DPH': 3268.2, 'cena s dph': None}, {'název': 'páska do tiskárny Epson LO 630', 'množství': 3, 'cena bez DPH': 1136.2, 'cena s dph': None}, {'název': 'podložka na křesla velká 53x58 cm Tex', 'množství': 12, 'cena bez DPH': 457.6, 'cena s dph': None}, {'název': 'ochranný kyčelní pás vel. L', 'množství': 1, 'cena bez DPH': 2773.3, 'cena s dph': None}, {'název': 'ochranný kyčelní pás vel. XL', 'množství': 1, 'cena bez DPH': 2773.3, 'cena s dph': None}, {'název': 'páska se štítky 2x41x17 barva bílá', 'množství': 2, 'cena bez DPH': 5561.15, 'cena s dph': None}, {'název': 'padák malý', 'množství': 1, 'cena bez DPH': 1181, 'cena s dph': None}, {'název': 'žínka Classic, barva pistáciová', 'množství': 26, 'cena bez DPH': 943.8, 'cena s dph': None}, {'název': 'ochranné polstrování postranic, large', 'množství': 10, 'cena bez DPH': 2213.33, 'cena s dph': None}]",23105885,Apos Brno
232,Centrum sociálních služeb Jeseník,21516161,852163,02.01.2023,"90 000,00 CZK",,Celoroční odběr zboží dle vlastního výběru.,"[{'název': 'Celoroční odběr zboží dle vlastního výběru', 'množství': None, 'cena bez DPH': 90000, 'cena s DPH': None}]",23089785,Apos Brno
233,Sociální služby města Moravská Třebová,21517669,194263,19.12.2022,"59 245,45 CZK","71 687,00 CZK",Kupní smlouva Apos - lis,"[{'název': 'zažehlovací lis Microseal v. č. MS-1577P', 'množství': 1, 'cena bez DPH': None, 'cena s DPH': None}, {'název': 'tiskárna EPSON LO630 v. č. X5PY009133', 'množství': 1, 'cena bez DPH': None, 'cena s DPH': None}, {'název': 'role se štítky 2x41x17', 'množství': 2, 'cena bez DPH': None, 'cena s DPH': None}, {'název': 'páska do tiskárny s voděodolnou barvou', 'množství': 1, 'cena bez DPH': None, 'cena s DPH': None}, {'název': 'SW pro potisk štítků APOS LabelPrint', 'množství': 1, 'cena bez DPH': None, 'cena s DPH': None}, {'název': 'držák rolí', 'množství': 1, 'cena bez DPH': None, 'cena s DPH': None}]",23091353,Apos Brno
234,"ANNA Český Brod, sociální služby pro seniory",21523705,873713,30.12.2022,"95 497,52 CZK","115 552,00 CZK","Nákup: 50ks přikrývek ,100ks polštářů","[{'název': 'plněný polštář LUXUS rozměr 90x70 1400g', 'množství': 100, 'cena bez DPH': 56850.0, 'cena s DPH': 68788.5}, {'název': 'prošívaná přikrývka LUXUS 1900g', 'množství': 50, 'cena bez DPH': 361775.0, 'cena s DPH': 437744.78}, {'název': 'přepravní náklady', 'množství': 1, 'cena bez DPH': 2470.0, 'cena s DPH': 2988.7}]",23097905,Apos Brno
235,Sdružení ozdravoven a léčeben okresu Trutnov,21516049,195201,13.01.2023,"118 061,45 CZK","142 854,35 CZK",Prostěradla pro RÚ Hostinné,"[{'název': 'elastická prostěradla obálkového střihu', 'množství': 300, 'cena bez DPH': None, 'cena s DPH': None}]",23089669,Apos Brno
236,Sociální služby města Moravská Třebová,21518505,194263,28.12.2022,"99 785,12 CZK","120 740,00 CZK",Kupní smlouva Apos - povlečení,"[{'název': 'bavlněné povlečení – vlny bílé na vínovém', 'množství': 25, 'cena bez DPH': None, 'cena s DPH': None}]",23092249,Apos Brno
237,Sociální služby města Moravská Třebová,21518513,194263,28.12.2022,"99 498,28 CZK","120 393,00 CZK",Kupní smlouva Apos - podložky,"[{'název': 'podložka EMERIS 75x85', 'množství': 240, 'cena bez DPH': None, 'cena s DPH': None}, {'název': 'podložka DUO+', 'množství': 100, 'cena bez DPH': None, 'cena s DPH': None}]",23092257,Apos Brno
238,"Domov seniorů Nové Strašecí, poskytovatel sociálních služeb",21268001,71209921,21.11.2022,"111 091,66 CZK","134 420,90 CZK","Dodávka prostěradel, povlečení, a polohovacích podložek","[{'název': 'napínací kluzné prostěradlo SWIFT', 'množství': 50, 'cena bez DPH': '873,6 Kč', 'cena s DPH': None}, {'název': 'elastické prostěradlo obálkového střihu - barva: zelená', 'množství': 50, 'cena bez DPH': '497,3 Kč', 'cena s DPH': None}, {'název': 'polohovací podložka SWIFT - velikost kluzné plochy: standard (126x110 cm)', 'množství': 50, 'cena bez DPH': '830,1 Kč', 'cena s DPH': None}, {'název': 'bavlněné povlečení - Ateliér béžový - zapínání: hot. kapsa', 'množství': 20, 'cena bez DPH': '608,2 Kč', 'cena s DPH': None}, {'název': 'bavlněné povlečení - Gobi šedá - zapínání: hot. kapsa', 'množství': 20, 'cena bez DPH': '557,3 Kč', 'cena s DPH': None}]",23081017,Apos Brno
239,Domovy Na Třešňovce,21499989,71193952,14.12.2022,"99 482,64 CZK",,Nákup podložek do lůžka,"[{'název': 'podložky Chamonix se záhyby, č.MIP 2011/F 85x90', 'množství': None, 'cena bez DPH': None, 'cena s dph': None}]",23072425,Apos Brno
240,"Domov seniorů Nové Strašecí, poskytovatel sociálních služeb",21327657,71209921,29.11.2022,"65 080,00 CZK","78 746,80 CZK",Dodávka 20 ks matrací,"[{'název': 'matrace Passive Medium Pro vel. 90x200x14 cm', 'množství': 20, 'cena bez DPH': None, 'cena s dph': None}]",23080769,Apos Brno
241,"Domov důchodců Velké Hamry, příspěvková organizace",21493213,71220003,22.12.2022,,"237 697,00 CZK","Objednávka podložek, fixního pásu","[{'název': 'fixační pás břišní', 'množství': None, 'cena bez DPH': None, 'cena s DPH': None}]",23065417,Apos Brno
242,Domov pro seniory Světlo,21474857,70869812,22.12.2022,"98 963,65 CZK","119 746,00 CZK",Objednávka inkontine.podložek,"[{'název': 'podložka SONO MA 85x90', 'množství': 170, 'cena bez DPH': 577.0, 'cena s dph': None}, {'název': 'zásilkové výdaje POB', 'množství': 7, 'cena bez DPH': 124.79, 'cena s dph': None}]",23045425,Apos Brno
243,"Domov pro seniory Vychodilova, příspěvková organizace",21465625,70887276,20.12.2022,"61 648,00 CZK","74 594,00 CZK","Nákup prostěradel, povlečení,","[{'název': 'Elastická prostěradla obálkového střihu MIP SK3400B/G/AB', 'množství': 25, 'cena bez DPH': None, 'cena s DPH': 497.3}, {'název': 'Elastické prostěradlo obálkového střihu MIP SK3400B/C/AB', 'množství': 25, 'cena bez DPH': None, 'cena s DPH': 497.3}, {'název': 'Bavlněné povlečení, had hnědý, DA PB had hnědý NK', 'množství': 25, 'cena bez DPH': None, 'cena s DPH': 557.3}, {'název': 'Bavlněné povlečení, indián zelený, DA PB indián zelený NK', 'množství': 25, 'cena bez DPH': None, 'cena s DPH': 557.3}, {'název': 'Plátěná podložka DA P150/170 170g', 'množství': 30, 'cena bez DPH': None, 'cena s DPH': 220.5}, {'název': 'Ručník 50x90 cm, TOW/HAND', 'množství': 84, 'cena bez DPH': None, 'cena s DPH': 1089}]",23035593,Apos Brno
244,"Domov Ždírec, příspěvková organizace",21401521,75002779,22.12.2022,"416 760,00 CZK",,"Kupní smlouva - prostěradla, povlečení a podložky","[{'název': 'Elastické prostěradlo obálkového střihu bílé', 'množství': 276, 'cena bez DPH': 411, 'cena s DPH': None}, {'název': 'Bavlněné povlečení ve třech dezénech, plastové knoflíky', 'množství': 330, 'cena bez DPH': 502.6, 'cena s DPH': None}, {'název': 'Podložka Emeris se záhyby', 'množství': 276, 'cena bez DPH': 236, 'cena s DPH': None}]",22967969,Apos Brno
245,Centrum sociálních služeb Jeseník,21360189,852163,15.12.2022,,"99 900,00 CZK",Evakuační podložku SKI SNEET 3N v počtu 44ks.,"[{'název': 'Evakuační podložku SKI SNEET 3N', 'množství': 44, 'cena bez DPH': None, 'cena s DPH': 99900}]",22923853,Apos Brno
246,"Domov seniorů Břeclav, příspěvková organizace",21340085,48452734,21.12.2022,"52 700,00 CZK",,Overaly se zipem,"[{'název': 'overaly se zipem na zádech', 'množství': 30, 'cena bez DPH': 1756, 'cena s dph': None}]",22902489,Apos Brno
247,"Domov Na Výsluní, Hořovice",21326025,70539456,23.12.2022,"39 435,12 CZK","47 716,50 CZK",Nákup prostěradel,"[{'název': 'elastické prostěradlo MIP. SK3400B/PE/AB obálkového střihu - barva: meruňková', 'množství': 50, 'cena bez DPH': None, 'cena s dph': '497,3 Kč'}, {'název': 'elastické prostěradlo MIP. SK3400B/Y/AB obálkového střihu - barva: žlutá', 'množství': 45, 'cena bez DPH': None, 'cena s dph': '497,3 Kč'}]",22886233,Apos Brno
248,"Sociální služby Vsetín, příspěvková organizace",21306921,49562827,22.12.2022,"16 064,00 CZK",,potahy na matrace,"[{'název': 'Potah na matraci', 'množství': 32, 'cena bez DPH': 16064, 'cena s DPH': 19437.4}]",22863893,Apos Brno
249,Domov pro seniory Krč,21301289,70874212,16.11.2022,"70 800,00 CZK","85 668,00 CZK",Nákup inkontinentních pratelných podložek,"[{'název': 'podložka EMERIS 75x85 se záhyby', 'množství': 300, 'cena bez DPH': 70800.0, 'cena s dph': 85668.0}]",22857869,Apos Brno
250,Domov důchodců Náchod,21306521,71193987,14.12.2022,"164 600,00 CZK","199 189,00 CZK","Dodání polohovacích podložek, kluzných prostěradel, fixních body kombinéz a nočních košil","[{'název': 'Napínací kluzné prostěradlo SWIFT (kód:MIP PTD-LS/S/UK)', 'množství': 30, 'cena bez DPH': 722, 'cena s DPH': 873.6}, {'název': 'Fixační pás břišní s upínáním v rozkroku (kód:VTLP 12)', 'množství': 20, 'cena bez DPH': 922, 'cena s DPH': 1115.6}]",22863489,Apos Brno
251,"Sociální služby Vsetín, příspěvková organizace",21304345,49562827,22.12.2022,"280 500,00 CZK",,povlečení,"[{'název': 'Povlečení - sada (polštář + přikrývka) II.', 'množství': 18, 'cena bez DPH': 505, 'cena s DPH': 611.05}]",22861105,Apos Brno
252,"Sociální služby Vsetín, příspěvková organizace",21304773,49562827,22.12.2022,"206 932,00 CZK",,prostěradla,"[{'název': 'Prostěradlo - elastické I.', 'množství': 442, 'cena bez DPH': 181662, 'cena s DPH': 219811}, {'název': 'Prostěradlo - elastické II.', 'množství': 35, 'cena bez DPH': None, 'cena s DPH': None}]",22861605,Apos Brno
253,Domov se zvláštním režimem Terezín,21273797,70875308,16.12.2022,"96 750,50 CZK","117 068,00 CZK","Objednávka(smlouva); rehabilitační pomůcky (venkovní trenažer, trenažer pro pohyblivé, trenažer pro ramena..)","[{'název': 'venkovní trenažér R7110A', 'množství': 1, 'cena bez DPH': '25600,00 Kč', 'cena s DPH': None}, {'název': 'trežažér pro pohyblivé r7131sra', 'množství': 1, 'cena bez DPH': '22750,00 Kč', 'cena s DPH': None}, {'název': 'trenažér pro ramena R7160D A', 'množství': 1, 'cena bez DPH': '19600,00 Kč', 'cena s DPH': None}, {'název': 'tenažér pro R7162A', 'množství': 1, 'cena bez DPH': '28800,00 Kč', 'cena s DPH': None}]",22828701,Apos Brno
254,"Domov pro seniory Radkova Lhota, příspěvková organizace",21279749,61985881,21.12.2022,"245 489,30 CZK","297 042,00 CZK",Objednávka na plněné polštáře LUXUS COMFORT 190 ks a prošívané přikrývky LUXUS 190 ks,"[{'název': None, 'množství': 190, 'cena bez DPH': None, 'cena s DPH': '297042.00 Kč'}]",22835145,Apos Brno
255,"Sociální služby pro seniory Šumperk, příspěvková organizace",21279401,75004011,19.12.2022,"95 754,71 CZK","115 863,20 CZK",3 ks zvedací židle s transportní taškou (pro uživatele služeb),"[{'název': 'zvedací židle s transportní taškou', 'množství': 3, 'cena bez DPH': None, 'cena s dph': '115863.20 Kč'}]",22834781,Apos Brno
256,Ošetřovatelský domov Praha 3,21256229,65990641,14.12.2022,"47 217,88 CZK","57 133,63 CZK","Vybavení pro klienty: deky mikroflanel, podložky na křesla, dřevěný kalendář, zvuková hra","[{'název': 'Kalendář dřevěný komplet s obrázky 40x40', 'množství': 3, 'cena bez DPH': '2308,00 Kč', 'cena s DPH': '2783,68 Kč'}, {'název': 'Zvukové loto zvířata', 'množství': 2, 'cena bez DPH': '1168 Kč', 'cena s DPH': '1413,28 Kč'}, {'název': 'Deka mirkoflanel — různé barvy', 'množství': 80, 'cena bez DPH': '430,65 Kč', 'cena s DPH': '520,89 Kč'}, {'název': 'Podložka na křesla 45x45cm hnědá', 'množství': 7, 'cena bez DPH': '375,00 Kč', 'cena s DPH': '453,75 Kč'}, {'název': 'doprava', 'množství': None, 'cena bez DPH': '877,69 Kč', 'cena s DPH': '1062,00 Kč'}]",22810037,Apos Brno
257,Domov důchodců Lampertice,21259997,195022,20.12.2022,"144 295,04 CZK","174 597,00 CZK","Polštáře, deky, prostěradla","[{'název': 'plněný polštář LUXUS rozměr 90x70 1400g', 'množství': 55, 'cena bez DPH': 523.02, 'cena s DPH': 28766.1}, {'název': 'prošívaná přikrývka LUXUS 1900g', 'množství': 55, 'cena bez DPH': 665.67, 'cena s DPH': 36611.63}, {'název': 'přepravní náklady', 'množství': 1, 'cena bez DPH': 3293.6, 'cena s DPH': 3985.26}]",22814017,Apos Brno
258,"Domov Ždírec, příspěvková organizace",21253725,75002779,06.12.2022,,"59 677,00 CZK",Kupní smlouva na nákup elastických prostěradel,"[{'název': 'Elastické prostěradlo obálkového střihu meruňkové', 'množství': 60, 'cena bez DPH': 411, 'cena s dph': None}, {'název': 'Elastické prostěradlo obálkového střihu krémové', 'množství': 60, 'cena bez DPH': 411, 'cena s dph': None}]",22807417,Apos Brno
259,KruV - RS (Kraj Vysočina),21212173,70890749,15.12.2022,"274 844,85 CZK","332 562,27 CZK","Kupní smlouva - Dodávka lůžkovin rámci projektu „Domov Ždírec - pracoviště Jihlava""","[{'název': 'Plněný polštář LUXUS COMFORT', 'množství': 220, 'cena bez DPH': '125070.00 Kč', 'cena s DPH': '151334.70 Kč'}, {'název': 'prošívaná přikrývka LUXUS', 'množství': 207, 'cena bez DPH': '149774.85 Kč', 'cena s DPH': '181227.57 Kč'}]",22763321,Apos Brno
260,"Centrum sociálních služeb Znojmo, příspěvková organizace",21193117,45671770,14.12.2022,,"96 748,00 CZK",Prostěradla obálkového střihu,"[{'název': 'Elastické prostěradlo obálkového střihu', 'množství': 200, 'cena bez DPH': '398,67 Kč', 'cena s DPH': '96.748,00 Kč'}]",22743165,Apos Brno
261,Domov důchodců Černožice,21177833,579017,09.12.2022,,"162 253,00 CZK","objednávka na dodávku povlečení, prostěradel, ručníků, fixační pás","[{'název': 'povlečení, prostěradla, ručníky, fixační pás břišní', 'množství': None, 'cena bez DPH': None, 'cena s DPH': None}]",22727169,Apos Brno
262,Domov důchodců Černožice,21177781,579017,09.12.2022,,"83 044,00 CZK","Objednávka na dodávku podložek CHAMONIX, chrániče oděvu","[{'název': 'podložka CHAMONIX 85x90 se záhyby', 'množství': 100, 'cena bez DPH': None, 'cena s DPH': None}, {'název': 'chránič oděvu malý 45x60', 'množství': 10, 'cena bez DPH': None, 'cena s DPH': None}]",22727113,Apos Brno
263,"Domov Bílá Opava, příspěvková organizace",21136145,16772,09.12.2022,"84 545,68 CZK",,Nákup evakuačních podložek MIP_CS635-001 včetně dodávky,"[{'název': 'Evakuační podložky MIP CS635-001', 'množství': 62, 'cena bez DPH': 1363.64, 'cena s DPH': None}]",22684037,Apos Brno
264,"Domov pro seniory Hvízdal České Budějovice, příspěvková organizace",21129609,666238,05.12.2022,,"98 000,00 CZK","Polštáře s povlaky, overaly","[{'název': 'Podpůrný polštář Delta', 'množství': 30, 'cena bez DPH': None, 'cena s DPH': None}, {'název': 'Bavlněný povlak na polštář', 'množství': 60, 'cena bez DPH': None, 'cena s DPH': None}, {'název': 'Overal zip v rozkroku', 'množství': 15, 'cena bez DPH': None, 'cena s DPH': None}]",22676949,Apos Brno
265,"Domov pro seniory Frýdek-Místek, příspěvková organizace",21106121,68158025,06.12.2022,"74 629,75 CZK",,fixační pásy a mikroflanelové deky,"[{'název': 'fixační pás břišní s upínáním v rozkroku', 'množství': 12, 'cena bez DPH': 272451, 'cena s DPH': 3206.66}, {'název': 'fixační pás břišní široký', 'množství': 11, 'cena bez DPH': 297963, 'cena s DPH': 3605.35}, {'název': 'fixační pás pětibodový', 'množství': 14, 'cena bez DPH': 275209, 'cena s DPH': 3330.03}, {'název': 'deka mikroflanel světle modrá', 'množství': None, 'cena bez DPH': 11453.14, 'cena s DPH': 13858.3}, {'název': 'deka mikroflanel tyrkysová', 'množství': None, 'cena bez DPH': 10604.76, 'cena s DPH': 12831.76}, {'název': 'deka mikroflanel skořicová', 'množství': None, 'cena bez DPH': 22057.9, 'cena s DPH': 26690.06}, {'název': 'přepravní náklady - bonus', 'množství': 1, 'cena bez DPH': 0.0, 'cena s DPH': 0.0}]",22652521,Apos Brno
266,Domov důchodců Náchod,21085661,71193987,30.11.2022,"41 454,00 CZK","50 157,00 CZK",Dodání 90 ks ložního prádla pro klienty zařízení,"[{'název': 'Bavlněné povlečení — Egypt fialový, hot. kapsa', 'množství': 30, 'cena bez DPH': 460.6, 'cena s DPH': 557.3}, {'název': 'Bavlněné povlečení — Egypt zelený, hot. kapsa', 'množství': 30, 'cena bez DPH': 460.6, 'cena s DPH': 557.3}, {'název': 'Bavlněné povlečení — planetárium oranžové, hot. kapsa', 'množství': 30, 'cena bez DPH': 460.6, 'cena s DPH': 557.3}]",22631105,Apos Brno
267,Domov důchodců Dobrá Voda,21059613,666262,05.12.2022,,"78 555,00 CZK",Objednávka - koupě ochranného polstrování postranic,"[{'název': 'ochranné polstrování postranic (1 pár) large', 'množství': 2, 'cena bez DPH': None, 'cena s dph': 213.0}, {'název': 'doprava', 'množství': 1, 'cena bez DPH': None, 'cena s dph': 1100.0}]",22603525,Apos Brno
268,"Domov pro seniory Máj České Budějovice, příspěvková organizace",21011533,71173064,14.11.2022,"217 397,00 CZK","263 050,00 CZK",nákup povlečení a prostěradel,"[{'název': 'Elastické prostěradlo obálkového střihu', 'množství': 150, 'cena bez DPH': 411, 'cena s DPH': None}, {'název': 'Podpůrný polštář s povlakem', 'množství': 5, 'cena bez DPH': 985, 'cena s DPH': None}, {'název': 'Krepové povlečení', 'množství': 270, 'cena bez DPH': 558.6, 'cena s DPH': None}]",22552797,Apos Brno
269,Domov u studánky,21022381,854310,21.11.2022,,"107 683,70 CZK","povlečení, lůžkoviny, pytle na prádlo - jednorázový nákup","[{'název': 'elastické prostěradlo obálkového střihu - tmavomodrá', 'množství': 35, 'cena bez DPH': '14 385,00 Kč', 'cena s dph': None}, {'název': 'podložka Fusion/Dermacare', 'množství': 40, 'cena bez DPH': '23 200,00 Kč', 'cena s dph': None}, {'název': 'podložka Emeris', 'množství': 20, 'cena bez DPH': '4 720,00 Kč', 'cena s dph': None}, {'název': 'nepromokavý pytel na prádlo - barva: červená', 'množství': 10, 'cena bez DPH': '6 050,00 Kč', 'cena s dph': None}, {'název': 'nepromokavý pytel na prádlo - barva: modrá', 'množství': 10, 'cena bez DPH': '6 050,00 Kč', 'cena s dph': None}, {'název': 'nepromokavý pytel na prádlo - barva: zelená', 'množství': 10, 'cena bez DPH': '6 050,00 Kč', 'cena s dph': None}, {'název': 'podložka na křesla: hnědá', 'množství': 20, 'cena bez DPH': '7 500,00 Kč', 'cena s dph': None}, {'název': 'bavlněné povlečení - káva hnědá', 'množství': 4, 'cena bez DPH': '1 761,00 Kč', 'cena s dph': None}, {'název': 'bavlněné povlečení - planetárium oranžové', 'množství': 4, 'cena bez DPH': '1.761,00 Kč', 'cena s dph': None}, {'název': 'krepové povlečení - kvítí na šedém', 'množství': 4, 'cena bez DPH': '2 234,40 Kč', 'cena s dph': None}, {'název': 'bavlněné povlečení - vlny bílé na vínovém', 'množství': 4, 'cena bez DPH': '2 010,40 Kč', 'cena s dph': None}]",22564397,Apos Brno
270,"Sociální služby Vsetín, příspěvková organizace",20986017,49562827,29.11.2022,,"100 938,00 CZK",pytle,"[{'název': 'Polyesterový pytel se šňůrkou a pojistkou zelený', 'množství': None, 'cena bez DPH': 302, 'cena s dph': None}, {'název': 'Polyesterový pytel se šňůrkou a pojistkou modrý', 'množství': None, 'cena bez DPH': 302, 'cena s dph': None}, {'název': 'Nepromokavý pytel na prádlo 75x102 cm červený okraj', 'množství': None, 'cena bez DPH': 605, 'cena s dph': None}]",22525833,Apos Brno
271,Domov pro seniory Horní Stropnice,20945481,666254,23.11.2022,,"82 903,00 CZK","prádlo dle výběru (pytle, povlečení, ručníky, prostěradla)","[{'název': 'pytel se šňůrkou a pojistkou červený', 'množství': 25, 'cena bez DPH': None, 'cena s DPH': None}, {'název': 'bavlněné povlečení', 'množství': 50, 'cena bez DPH': None, 'cena s DPH': None}, {'název': 'nepromokavý pytel samorozeviratelný', 'množství': 15, 'cena bez DPH': None, 'cena s DPH': None}, {'název': 'ručník 50x90 sv.zelená bal.6 ks', 'množství': 5, 'cena bez DPH': None, 'cena s DPH': None}, {'název': 'osuška 70x125 sv.zelená bal. 6 ks', 'množství': 5, 'cena bez DPH': None, 'cena s DPH': None}, {'název': 'ručník 50x90 vínová bal.6 ks', 'množství': 2, 'cena bez DPH': None, 'cena s DPH': None}, {'název': 'elastické napínací prostěradlo krémové', 'množství': 10, 'cena bez DPH': None, 'cena s DPH': None}, {'název': 'elastické prostěradlo obálkový střih', 'množství': 20, 'cena bez DPH': None, 'cena s DPH': None}]",22483005,Apos Brno
272,Domov pro seniory Vrchlabí,20918949,194891,24.11.2022,,"137 076,00 CZK","podložky,povlečení,anděl,overal,chránič oděvů","[{'název': 'podložka Sonoma 85 x 90 cm', 'množství': 10, 'cena bez DPH': None, 'cena s dph': None}, {'název': 'bavlněné povlečení', 'množství': 60, 'cena bez DPH': None, 'cena s dph': None}, {'název': 'elastické prostěradlo obálkového střihu', 'množství': 40, 'cena bez DPH': None, 'cena s dph': None}, {'název': 'chránič oděvu malý', 'množství': 40, 'cena bez DPH': None, 'cena s dph': None}, {'název': 'dámská košile anděl PLUS', 'množství': 20, 'cena bez DPH': None, 'cena s dph': None}, {'název': 'pánská košile anděl PLUS', 'množství': 20, 'cena bez DPH': None, 'cena s dph': None}, {'název': 'speciální overal se dvěma zipy', 'množství': 16, 'cena bez DPH': None, 'cena s dph': None}]",22455757,Apos Brno
273,Domov pro seniory Trutnov,20913121,70153906,23.11.2022,,"134 976,00 CZK",Dodávka podložek Sonoma a elastických prostěradel,"[{'název': 'podložka Sonoma 85 x 90 cm se záložkami', 'množství': 120, 'cena bez DPH': None, 'cena s dph': None}, {'název': 'elastické prostěradlo obálkového střihu žluté', 'množství': 120, 'cena bez DPH': None, 'cena s dph': None}]",22449737,Apos Brno
274,Domov Dědina,20889117,42886163,10.11.2022,"61 255,10 CZK","74 118,70 CZK",Objednávka inkontinenčních podložek,"[{'název': 'podložka CHAMONIX 85x90', 'množství': 70, 'cena bez DPH': 848.2, 'cena s DPH': None}, {'název': 'podložka FUSION/DERMACARE 90x90', 'množství': 20, 'cena bez DPH': 701.8, 'cena s DPH': None}]",22424365,Apos Brno
275,Centrum sociálních služeb Jeseník,20898425,852163,08.11.2022,"60 000,00 CZK",,Objednáváme u Vás: Zboží dle vlastního výběru.,"[{'název': 'Zboží dle vlastního výběru', 'množství': None, 'cena bez DPH': '60000,00 CZK', 'cena s DPH': None}]",22434125,Apos Brno
276,SOCIÁLNÍ SLUŽBY LANŠKROUN,20871545,75081849,15.11.2022,,"124 008,00 CZK",Objednávka - krepové povlečení,"[{'název': 'fixační pás břišní upínací', 'množství': 15, 'cena bez DPH': 115.62, 'cena s DPH': None}, {'název': 'fixační pás pětibodový', 'množství': 6, 'cena bez DPH': 690.37, 'cena s DPH': None}, {'název': 'krepové povlečení', 'množství': 90, 'cena bez DPH': 675.91, 'cena s DPH': None}, {'název': 'podložka na křesla', 'množství': 80, 'cena bez DPH': 453.75, 'cena s DPH': None}]",22405973,Apos Brno
277,Domov pod Kuňkou,20847549,71176217,16.11.2022,,"69 238,30 CZK","Objednávka na prošívané přikrývky, podložky na křesla","[{'název': 'prošívaná přikrývka LUXUS', 'množství': 40, 'cena bez DPH': None, 'cena s DPH': 875.5}, {'název': 'podložka na křesla velká 53x58 cm TEX - modrá', 'množství': 10, 'cena bez DPH': None, 'cena s DPH': 3715}, {'název': 'podložka na křesla velká 53x58 cm TEX - hnědá', 'množství': 26, 'cena bez DPH': None, 'cena s DPH': 3715}, {'název': 'podložka na křesla velká 53x58 cm TEX - zelená', 'množství': 18, 'cena bez DPH': None, 'cena s DPH': 3715}, {'název': 'podložka na křesla velká 53x58 cm TEX - vínová', 'množství': 12, 'cena bez DPH': None, 'cena s DPH': 3715}, {'název': 'podložka na křesla 40x50 cm - červená', 'množství': 6, 'cena bez DPH': None, 'cena s DPH': 453.8}, {'název': 'podložka na křesla 40x50 cm - černá', 'množství': 6, 'cena bez DPH': None, 'cena s DPH': 453.8}]",22380925,Apos Brno
278,Sdružení ozdravoven a léčeben okresu Trutnov,20815345,195201,11.11.2022,"110 191,69 CZK","133 331,94 CZK",Povlečení pro RÚ Hostinné,"[{'název': 'bavlněné povlečení — Indián bílý (hotelová kapsa)', 'množství': 235, 'cena bez DPH': None, 'cena s DPH': None}]",22346833,Apos Brno
