,Odběratel,ID,IČO,Datum uzavření smlouvy,Cena_bez_dph,Cena_s_dph,Předmět smlouvy,zboží,ID verze,Dodavatel
131,"Domov pro seniory Sokolnice, příspěvková organizace",24924815,209392,29.11.2023,"61 606,00 CZK","74 543,00 CZK",Zažehlovací lis s příslušenstvím,"[{'název': 'Zažehlovací lis s příslušenstvím', 'množství': 1, 'cena bez DPH': 61606, 'cena s DPH': 74543}, {'název': 'Páska se štítky', 'množství': 1, 'cena bez DPH': 4596, 'cena s DPH': 5561.16}, {'název': 'páska do tiskárny Epson LO 630', 'množství': 1, 'cena bez DPH': 939, 'cena s DPH': 1136.19}, {'název': 'sw pro potisk štítků APOS LabelPrint', 'množství': 1, 'cena bez DPH': 8889.92, 'cena s DPH': 10756.8}, {'název': 'držák rolí DR 100', 'množství': 1, 'cena bez DPH': 1907.5, 'cena s DPH': 2308.08}, {'název': 'tiskárma EPSON LO 630', 'množství': 1, 'cena bez DPH': 10986, 'cena s DPH': 13293.06}, {'název': 'instalace systému', 'množství': 2, 'cena bez DPH': 890, 'cena s DPH': 2153.8}, {'název': 'jízdné technika', 'množství': 40, 'cena bez DPH': 640, 'cena s DPH': 774.4}]",26678375,Apos Brno
132,Barevné domky Hajnice,24934131,194972,06.11.2023,,"193 000,00 CZK","Ložní prádlo, krepové povlečení","[{'název': 'Ložní prádlo, krepové povlečení', 'množství': None, 'cena bez DPH': 193000, 'cena s DPH': None}]",26688219,Apos Brno
133,Domov důchodců Náchod,24930855,71193987,29.11.2023,"66 552,00 CZK","80 528,00 CZK",dODÁNÍ 300 KS PODLOŽEK emeris 75x85,"[{'název': 'Podložka EMERIS 75x85 se záhyby', 'množství': 300, 'cena bez DPH': 268.43, 'cena s DPH': 80.528}]",26684807,Apos Brno
134,Domov důchodců Černožice,24888215,579017,27.11.2023,,"84 820,00 CZK",Objednávka č. 485/2023 na inkontinenční podložky Chamonix,"[{'název': 'Inkontinenční podložky Chamonix se záhyby', 'množství': 100, 'cena bez DPH': 84.82, 'cena s DPH': None}]",26640211,Apos Brno
135,"Domov pro seniory Radkova Lhota, příspěvková organizace",24887951,61985881,27.11.2023,"154 618,18 CZK","187 088,00 CZK","Objednávka na elastická prostěradla obálkového střihu, 418 ks","[{'název': 'Elastické prostěradlo obálkového střihu', 'množství': 418, 'cena bez DPH': 154618.18, 'cena s DPH': 187088.0}]",26639943,Apos Brno
136,Domov pro seniory Pilníkov,24870711,195031,21.06.2023,,"96 094,00 CZK",Nákup textilu,"[{'název': 'Páska se štítky 2x41x17 bílá WPSD1700', 'množství': 2.005, 'cena bez DPH': 4596.0, 'cena s DPH': 11232.32}, {'název': 'Podložka CHAMONIX 85x90 se záhyby MIP 2011/F', 'množství': 100, 'cena bez DPH': 70100.0, 'cena s DPH': 84821.0}]",26621803,Apos Brno
137,"Centrum sociálních služeb Domažlice, příspěvková organizace",24856995,75007754,24.11.2023,"77 671,70 CZK","93 982,80 CZK","10x podpůrný polštář, 10x potah na polštář, 40x ochr. polstrování postranic","[{'název': 'Podpůrný polštář DELTA', 'množství': 5, 'cena bez DPH': None, 'cena s dph': None}, {'název': 'Bavlněný potah na polštář DELTA', 'množství': 5, 'cena bez DPH': None, 'cena s dph': None}, {'název': 'Ochranné polstrování postranic - pár standard', 'množství': 20, 'cena bez DPH': None, 'cena s dph': None}]",26607675,Apos Brno
138,Domov důchodců Černožice,24824843,579017,20.11.2023,,"397 844,00 CZK",Objednávka č. 461/2023 dle přílohy,"[{'název': None, 'množství': None, 'cena bez DPH': None, 'cena s DPH': None}]",26573831,Apos Brno
139,Domov u fontány,24814935,71176225,10.11.2023,"115 890,90 CZK","140 228,00 CZK",Nákup 70ks evakuačních podložek,"[{'název': 'evakuační podložky SKI SHEET 3N', 'množství': 70, 'cena bez DPH': None, 'cena s dph': None}]",26563527,Apos Brno
140,"Nemocnice Tábor, a.s.",24814407,26095203,07.11.2023,,"163 334,00 CZK",Objednávka na lůžkoviny,"[{'název': 'Maanetický klíč červený s karabinkou, SF1209', 'množství': 2, 'cena bez DPH': 206.63, 'cena s DPH': 500.04}, {'název': 'Maanetický zámek červený, SF1206', 'množství': 2, 'cena bez DPH': 228.0, 'cena s DPH': 551.76}, {'název': 'Bavlněné povlečení kvítí na šedém, kapsa, DA B kviti na s-HK, 1+1', 'množství': 125, 'cena bez DPH': 538.5, 'cena s DPH': 81448.13}, {'název': 'Elastické prostěradlo obálkového střihu', 'množství': 125, 'cena bez DPH': 369.9, 'cena s DPH': 55947.38}, {'název': 'oostranic, 87x83', 'množství': 2, 'cena bez DPH': 1371.9, 'cena s DPH': 3320.0}, {'název': 'Ručník 50x90 vínová (6ks/sada)', 'množství': 3, 'cena bez DPH': 900.0, 'cena s DPH': 3267.0}]",26561967,Apos Brno
141,"Domov ve Zboží, příspěvková organizace",24785083,60128097,01.11.2023,"200 000,00 CZK","242 000,00 CZK","Rámcová kupní smlouva - ložní prádlo, ručníky ..","[{'název': None, 'množství': None, 'cena bez DPH': None, 'cena s DPH': None}]",26529039,Apos Brno
142,"Domov pro seniory Dobětice, příspěvková organizace",24784971,44555407,20.11.2023,"65 367,85 CZK","80 000,00 CZK",Objednávka - zažehlovací systém,"[{'název': 'Zažehlovací systém', 'množství': None, 'cena bez DPH': None, 'cena s DPH': None}]",26528927,Apos Brno
143,"Dům sociálních služeb Pacov, p. o.",24789451,63893703,10.11.2023,"102 990,08 CZK",,Textilní výrobky,"[{'název': 'Elastické prostěradlo obálkového modré střihu', 'množství': 40, 'cena bez DPH': 411.0, 'cena s DPH': 497.21}, {'název': 'Elastické prostěradlo obálkového žluté střihu', 'množství': 20, 'cena bez DPH': 411.0, 'cena s DPH': 497.21}, {'název': 'Chránič oděvu velký 45x90 vzor 1 bez kapsy', 'množství': 60, 'cena bez DPH': 340.0, 'cena s DPH': 411.4}, {'název': 'Nepromokavý pytel na prádlo 75x102 cm modrý', 'množství': 30, 'cena bez DPH': 605.0, 'cena s DPH': 731.05}, {'název': 'Podložka na křesla Sonoma 43x61 cm', 'množství': 40, 'cena bez DPH': 164.0, 'cena s DPH': 198.44}, {'název': 'Podložka CHAMONIX 85x90 bez záhybů', 'množství': 30, 'cena bez DPH': 640.0, 'cena s DPH': 774.4}, {'název': 'Podložka CHAMONIX 85x90 se záhyby', 'množství': 20, 'cena bez DPH': 701.0, 'cena s DPH': 848.21}, {'název': 'Zásilkové výdaje - bonus', 'množství': 8, 'cena bez DPH': 0.0, 'cena s DPH': 0.0}]",26533603,Apos Brno
144,"Domov F. A. Skuherského, z. ú.",24793135,9618724,20.11.2023,,"61 549,00 CZK",Objednávka - evakuační podložky,"[{'název': 'Evakuační podložka Transtex se dvěma popruhy', 'množství': 43, 'cena bez DPH': 1182.96, 'cena s dph': None}]",26537595,Apos Brno
145,"Albertinum, odborný léčebný ústav, Žamberk",24784379,196096,16.11.2023,"206 880,96 CZK","250 325,96 CZK",Objednávka prostěradel,"[{'název': 'Elastické prosteradlo obálkového strihu bílé', 'množství': 150, 'cena bez DPH': None, 'cena s DPH': None}, {'název': 'Elastické prosteradlo obálkového strihu merunkové', 'množství': None, 'cena bez DPH': None, 'cena s DPH': None}, {'název': 'Elastické prosteradlo obálkového strihu zelené', 'množství': None, 'cena bez DPH': None, 'cena s DPH': None}, {'název': 'Elastické prosteradlo obálkového strihu krémové', 'množství': None, 'cena bez DPH': None, 'cena s DPH': None}]",26528295,Apos Brno
146,"Domov seniorů Hranice, příspěvková organizace",24776135,70876541,15.11.2023,"56 886,00 CZK","68 832,00 CZK",akceptace objednávky - ochrana postranic,"[{'název': 'ochrana postranic', 'množství': 34, 'cena bez DPH': None, 'cena s dph': None}]",26519743,Apos Brno
147,"Domov pro seniory Strážnice, příspěvková organizace",24746555,47375604,13.11.2023,"20 723,00 CZK","25 075,00 CZK",Dodávka tiskárny a zdravotnického materiálu,"[{'název': 'Tiskárna EPSON LO 630', 'množství': None, 'cena bez DPH': '10 986 Kč', 'cena s DPH': '13 293,06 Kč'}, {'název': 'Páska do tiskárny Apson LO 630', 'množství': None, 'cena bez DPH': '939 Kč', 'cena s DPH': '1 136,19 Kč'}, {'název': 'SW pro tisk štítků', 'množství': None, 'cena bez DPH': '980 Kč', 'cena s DPH': '1 185,80 Kč'}, {'název': 'Omyvatelný polohovací polštář Delta', 'množství': 4, 'cena bez DPH': '3 352 Kč', 'cena s DPH': '4 055,92 Kč'}, {'název': 'Povlak na polštář Delta', 'množství': 8, 'cena bez DPH': '1 664 Kč', 'cena s DPH': '2 013,44 Kč'}, {'název': 'Nepromokavý pytel na prádlo červený', 'množství': 1, 'cena bez DPH': '605 Kč', 'cena s DPH': '732,05 Kč'}, {'název': 'Nepromokavý pytel na prádlo modrý', 'množství': 1, 'cena bez DPH': '605 Kč', 'cena s DPH': '732,05 Kč'}, {'název': 'Nepromokavý pytel na prádlo bílý', 'množství': 1, 'cena bez DPH': '605 Kč', 'cena s DPH': '732,05 Kč'}, {'název': 'Nepromokavý pytel na prádlo zelený', 'množství': 1, 'cena bez DPH': '605 Kč', 'cena s DPH': '732,05 Kč'}, {'název': 'Zásilkové výdaje', 'množství': None, 'cena bez DPH': '381,82 Kč', 'cena s DPH': '462 Kč'}]",26488351,Apos Brno
148,"Odborný léčebný ústav Paseka, příspěvková organizace",24730859,849081,10.11.2023,"88 113,00 CZK",,"Ochranné polstrování postranic, Elastická prostěradla, podložky EMERIS","[{'název': 'Ochranné polstrování postranic— pár, standard', 'množství': 5, 'cena bez DPH': None, 'cena s DPH': 9910}, {'název': 'Elastické prostěradlo obálkového střihu bílé', 'množství': None, 'cena bez DPH': None, 'cena s DPH': None}, {'název': 'Podložka EMERIS 75x85', 'množství': 150, 'cena bez DPH': None, 'cena s DPH': 37215}, {'název': 'Přepravné', 'množství': 1, 'cena bez DPH': None, 'cena s DPH': 204}]",26471763,Apos Brno
149,"Sociální služby Vsetín, příspěvková organizace",24726451,49562827,07.11.2023,"117 602,50 CZK",,"nákup - zažehlovací lis,pytel,chránič oděvů,přikrývka,polštář","[{'název': 'zažehlovací lis RS 100 Nr včetně 2 ks silikonová podložka', 'množství': 1, 'cena bez DPH': 32712.5, 'cena s DPH': None}, {'název': 'nepromokavý pytel na prádlo 75x102 cm červený', 'množství': 20, 'cena bez DPH': 574.75, 'cena s DPH': None}, {'název': 'polyesterový pytel se šňůrkou a pojistkou zelený', 'množství': 30, 'cena bez DPH': 471.8, 'cena s DPH': None}, {'název': 'chránič oděvu velký 45x90 vzor 1 bez kapsy', 'množství': 20, 'cena bez DPH': 306.0, 'cena s DPH': None}, {'název': 'omyvatelná přikrývka Sanitized 200x140 celoroční', 'množství': 20, 'cena bez DPH': 2109.95, 'cena s DPH': None}, {'název': 'omyvatelný polštář Kombi Sanitized velký 85x65', 'množství': 20, 'cena bez DPH': 546.1, 'cena s DPH': None}]",26466879,Apos Brno
150,"Domov Čujkovova, Ostrava-Zábřeh, příspěvková organizace",24693683,70631875,09.11.2023,"330 451,00 CZK","399 845,00 CZK",Nákup prostěradel,"[{'název': 'elastické napínací prostěradlo obálkového střihu', 'množství': 1000, 'cena bez DPH': 328.8, 'cena s DPH': None}]",26432595,Apos Brno
151,Domov pro seniory Chodov,24704243,70876606,07.11.2023,,"80 033,00 CZK",evakuační podložky,"[{'název': 'Evakuační podložka Transtex se dvěma popruhy', 'množství': 52, 'cena bez DPH': '1 272 Kč', 'cena s dph': None}]",26443723,Apos Brno
152,"Domov pro seniory Radkova Lhota, příspěvková organizace",24683707,61985881,09.11.2023,"95 463,60 CZK","115 511,00 CZK","Objednávka na evakuační podložky Transtex se dvěma popruhy, 79ks","[{'název': 'Evakuační podložka Transtex se dvěma popruhy', 'množství': 79, 'cena bez DPH': 1208.4, 'cena s DPH': 1462.16}]",26422159,Apos Brno
153,"Dům sociálních služeb Pacov, p. o.",24657083,63893703,19.10.2023,"258 782,64 CZK",,Textilní výrobky,"[{'název': 'Nepromokavý pytel na prádlo zelený', 'množství': 60, 'cena bez DPH': 574.75, 'cena s DPH': 41726.85}, {'název': 'Samorozevíratelný nepromokavý červený pytel SAFETEX', 'množství': 5, 'cena bez DPH': 546.25, 'cena s DPH': 3304.81}, {'název': 'Plněný polštář LUXUS rozměr 90x70 1400g COMFORT', 'množství': 20, 'cena bez DPH': 597.46, 'cena s DPH': 14458.41}, {'název': 'Plátěná podložka do lůžka bílá 170 g', 'množství': 60, 'cena bez DPH': 173.14, 'cena s DPH': 12569.78}, {'název': 'Podložka CHAMONIX 85x90 se záhyby', 'množství': 150, 'cena bez DPH': 665.95, 'cena s DPH': 120869.93}, {'název': 'Fixační pás pětibodový dospělý', 'množství': 3, 'cena bez DPH': 1327.15, 'cena s DPH': 4817.55}, {'název': 'Elastické prostěradlo obálkového střihu žluté', 'množství': 50, 'cena bez DPH': 390.45, 'cena s DPH': 23622.23}, {'název': 'Elastické prostěradlo obálkového střihu meruňkové', 'množství': 50, 'cena bez DPH': 390.45, 'cena s DPH': 23622.23}, {'název': 'Bavlněné povlečení - Slezsko zip šedé', 'množství': 20, 'cena bez DPH': 511.58, 'cena s DPH': 12380.12}, {'název': 'Bavlněné povlečení - Slezsko zip zelené', 'množství': 20, 'cena bez DPH': 511.58, 'cena s DPH': 12380.12}, {'název': 'Zásilkové výdaje - bonus', 'množství': 22, 'cena bez DPH': 0.0, 'cena s DPH': 0.0}]",26394259,Apos Brno
154,"Domov seniorů Břeclav, příspěvková organizace",24652427,48452734,06.11.2023,"146 445,42 CZK",,"Prostěradla, overaly, chrániče","[{'název': 'Elastické prostěradlo obálkového střihu meruňkové', 'množství': 10, 'cena bez DPH': 369.9, 'cena s DPH': None}, {'název': 'Chránič oděvu veký 4590 vzor 1 bez kapsy', 'množství': 20, 'cena bez DPH': 3230.0, 'cena s DPH': None}, {'název': 'Krátký overal se zipem v rozkroku 4080 koráll', 'množství': 500, 'cena bez DPH': 1499.0, 'cena s DPH': None}, {'název': 'Overal se zipem na zádech A708 koráldmk L', 'množství': 1000, 'cena bez DPH': 1722.83, 'cena s DPH': None}]",26389499,Apos Brno
155,"Domov pro seniory Hustopeče, příspěvková organizace",24654827,14120097,06.11.2023,"170 334,74 CZK","206 105,00 CZK",objednávka - monitoring opuštění lůžka,"[{'název': 'Monitoring opuštění lůžka s podlahovou podložkou', 'množství': 10, 'cena bez DPH': 138580.0, 'cena s DPH': 168681.8}, {'název': 'Úprava pro bezdrátový přenos', 'množství': 10, 'cena bez DPH': 21000.0, 'cena s DPH': 25410.0}, {'název': 'Pager SR', 'množství': 10, 'cena bez DPH': 10500.0, 'cena s DPH': 12705.0}, {'název': 'zásilkové', 'množství': 2, 'cena bez DPH': 254.55, 'cena s DPH': 308.0}]",26391955,Apos Brno
156,"Centrum sociálních služeb Prostějov, příspěvková organizace",24625319,47921293,30.10.2023,"329 015,00 CZK","398 108,15 CZK",Objednávka - dodávka 205ks prošívaných přikrývek a 250ks polštářů.,"[{'název': 'Prošivaná přikrývka LUXUS', 'množství': 21, 'cena bez DPH': 838.0, 'cena s DPH': None}, {'název': 'Plněný polštář LUXUS COMFORT', 'množství': 1, 'cena bez DPH': 628.9, 'cena s DPH': None}]",26361031,Apos Brno
157,G-centrum Tábor,24613999,67189393,18.10.2023,,,"pytle na prádlo, prostěradla","[{'název': 'elastické napínací prostěradlo SMART', 'množství': 50, 'cena bez DPH': None, 'cena s DPH': None}, {'název': 'žluté pytle na prádlo +šňůra, pojistka', 'množství': 150, 'cena bez DPH': None, 'cena s DPH': None}]",26349327,Apos Brno
158,Domov pro seniory a Pečovatelská služba v Žatci,24612863,830411,03.11.2023,,"120 846,00 CZK",Objednávka elastických prostěradel,"[{'název': 'Elastické prostěradlo obálkového střihu, barva krémová', 'množství': 255, 'cena bez DPH': None, 'cena s dph': None}, {'název': 'SMART elastické napínací prostěradlo, barva bílá', 'množství': 15, 'cena bez DPH': None, 'cena s dph': None}]",26348151,Apos Brno
159,Domov se zvláštním režimem Krásná Lípa,24595311,70872741,01.11.2023,"77 052,89 CZK","93 234,00 CZK","Objednávka (smlouva) ""Prostěradla elastická v počtu 5 ks, přikrývky prošívané LUXUS v počtu 55 ks, polštáře LUXUS v počtu 55 ks, Čelakovského 40/13, Krásná Lípa, 407 46"".","[{'název': 'prostěradla elastická', 'množství': 5, 'cena bez DPH': None, 'cena s DPH': None}, {'název': 'přikrývky prošívané LUXUS', 'množství': 55, 'cena bez DPH': None, 'cena s DPH': None}, {'název': 'polštáře LUXUS COMFORT', 'množství': 55, 'cena bez DPH': None, 'cena s DPH': None}]",26329827,Apos Brno
160,"Domov Kladno-Švermov, poskytovatel sociálních služeb",24599139,71234462,23.10.2023,,"82 492,00 CZK","Zažehlovací lis na prádlo, tiskárna na prádlo","[{'název': 'Zažehlovací lis na prádlo, tiskárna na prádlo', 'množství': None, 'cena bez DPH': None, 'cena s DPH': '82 492,00 Kč'}]",26333859,Apos Brno
161,Domov důchodců Náchod,24599427,71193987,24.10.2023,"94 280,00 CZK","114 083,00 CZK",Dodání 70 ks fixačních pásů a 60 ks samorozevíratelných nepromokavých pytlů,"[{'název': 'Fixační pás břišní s upínáním v rozkroku', 'množství': 30, 'cena bez DPH': 922, 'cena s DPH': 1115.6}, {'název': 'Fixační pás břišní široký', 'množství': 30, 'cena bez DPH': 605, 'cena s DPH': 732.1}, {'název': 'Fixační pás pětibodový', 'množství': 10, 'cena bez DPH': 1397, 'cena s DPH': 1690.4}, {'název': 'Samorozevíratelný nepromokavý pytel SAFETEX - zelený', 'množství': 20, 'cena bez DPH': 575, 'cena s DPH': 698.8}, {'název': 'Samorozevíratelný nepromokavý pytel SAFETEX - modrý', 'množství': 20, 'cena bez DPH': 575, 'cena s DPH': 698.8}, {'název': 'Samorozevíratelný nepromokavý pytel SAFETEX - červený', 'množství': 20, 'cena bez DPH': 575, 'cena s DPH': 698.8}]",26334159,Apos Brno
162,"Domov Slaný, poskytovatel sociálních služeb",24582683,71234390,27.10.2023,"149 978,43 CZK","181 474,00 CZK",Objednávka ložní prádlo,[],26316415,Apos Brno
163,Sociální služby města Žďáru nad Sázavou,24561883,43379168,27.10.2023,,"59 000,00 CZK",DKS nákup evakuační podložka,"[{'název': 'evakuační podložka MIP. CS635-001', 'množství': 41, 'cena bez DPH': 1170, 'cena s dph': 1415.7}, {'název': 'zásilkové výdaje POB', 'množství': 2, 'cena bez DPH': 127.27, 'cena s dph': 153.8}]",26297171,Apos Brno
164,Domov pro seniory Zahradní Město,24538367,70878030,23.10.2023,"16 416,48 CZK","19 864,00 CZK",objednávka - fixační body,"[{'název': 'Fixační body bílé krátký rukáv se zipem v rozkroku', 'množství': 10, 'cena bez DPH': None, 'cena s DPH': None}, {'název': 'deky mikroflanel', 'množství': 28, 'cena bez DPH': None, 'cena s DPH': None}]",26269667,Apos Brno
165,"Domov pro seniory Hustopeče, příspěvková organizace",24550967,14120097,30.10.2023,"247 182,69 CZK","299 091,00 CZK",Dohoda o vypořádání bezdůvodného obohacení,"[{'název': 'ložní prádlo na pokoje klientů', 'množství': None, 'cena bez DPH': '180851.28 Kč', 'cena s DPH': '218830.00 Kč'}, {'název': 'tiskárna s příslušenstvím', 'množství': None, 'cena bez DPH': '33454.55 Kč', 'cena s DPH': '40480.00 Kč'}, {'název': 'zažehlovací lis', 'množství': None, 'cena bez DPH': '32876.86 Kč', 'cena s DPH': '39781.00 Kč'}]",26283115,Apos Brno
166,"Domov pro osoby se zdravotním postižením Horní Bříza, příspěvková organizace",24529971,22578,27.10.2023,"147 960,00 CZK","179 081,60 CZK",400 ks elastických prostěradel SMART,"[{'název': 'elastické napínací prostěradlo SMART vbílé', 'množství': 400, 'cena bez DPH': 369.9, 'cena s DPH': None}]",26260919,Apos Brno
167,"Domovy sociálních služeb Háj a Nová Ves, příspěvková organizace",24526207,63787911,16.10.2023,"63 224,88 CZK","76 502,00 CZK",Kupní smlouva č. 230022 - Nákup značkovače prádla,"[{'název': 'Zažehlovací lis RS 100 Nr (RS 378-01NR)', 'množství': None, 'cena bez DPH': None, 'cena s DPH': None}, {'název': 'SW pro potisk štítků APOS LabelPrint (APOS LABELPRINT)', 'množství': None, 'cena bez DPH': None, 'cena s DPH': None}, {'název': 'Držák rolí (DR 100)', 'množství': None, 'cena bez DPH': None, 'cena s DPH': None}, {'název': 'Tiskárna EPSON LO 630 (EPSON LO 630)', 'množství': None, 'cena bez DPH': None, 'cena s DPH': None}]",26257039,Apos Brno
168,"Dům seniorů Kdyně, příspěvková organizace",24440187,75007746,10.10.2023,,"51 715,00 CZK",Přikrývky,"[{'název': 'Přikrývka', 'množství': 50, 'cena bez DPH': None, 'cena s DPH': 715.0}]",26166363,Apos Brno
169,"Zahrada, poskytovatel sociálních služeb",24447547,71234446,20.10.2023,"35 348,79 CZK","42 772,00 CZK","Objednávka - tiskárna na značení oděvů, včetně příslušenství","[{'název': 'Tiskárna na značení oděvů, včetně příslušenství (pásky sw na potisk, držák rolí, instalace systému)', 'množství': None, 'cena bez DPH': 35348.79, 'cena s dph': 42712}]",26174139,Apos Brno
170,SOCIÁLNÍ SLUŽBY LANŠKROUN,24446899,75081849,18.10.2023,,"115 958,00 CZK","Objednávka - krepové povlečení, prostěradla","[{'název': 'elastické prostěradlo', 'množství': 90, 'cena bez DPH': 497.31, 'cena s dph': None}, {'název': 'ochranné návleky na ruce', 'množství': 2, 'cena bez DPH': 1356.41, 'cena s dph': None}]",26173467,Apos Brno
171,"Zahrada, poskytovatel sociálních služeb",24448243,71234446,20.10.2023,"32 827,00 CZK","39 721,00 CZK",Objednávka - zažehlovací lis,"[{'název': 'Zažehlovací lis', 'množství': None, 'cena bez DPH': '32827 Kč', 'cena s dph': '39721 Kč'}]",26174899,Apos Brno
172,"Domov pro seniory Velké Meziříčí, příspěvková organizace",24439735,71184465,18.10.2023,,"96 839,00 CZK","elastická prostěradla, overaly","[{'název': 'Omyvatelný podpůrný polštář DELTA', 'množství': 1, 'cena bez DPH': None, 'cena s DPH': None}, {'název': 'Povlak na polštář DELTA', 'množství': 1, 'cena bez DPH': None, 'cena s DPH': None}]",26165887,Apos Brno
173,"Domov Jílové u Prahy, poskytovatel sociálních služeb",24408975,44685173,04.10.2023,,"82 933,00 CZK",Zažehlovací lis,"[{'název': 'zažehlovací lis RS 100', 'množství': 1, 'cena bez DPH': None, 'cena s DPH': None}, {'název': 'tiskárna EPSON LO630', 'množství': 1, 'cena bez DPH': None, 'cena s DPH': None}, {'název': 'role se štítky 2x41x17', 'množství': 2, 'cena bez DPH': None, 'cena s DPH': None}, {'název': 'páska do tiskárny s voděodolnou barvou', 'množství': 1, 'cena bez DPH': None, 'cena s DPH': None}, {'název': 'SW pro potisk štítků APOS LabelPrint', 'množství': 1, 'cena bez DPH': None, 'cena s DPH': None}, {'název': 'držák rolí', 'množství': 1, 'cena bez DPH': None, 'cena s DPH': None}]",26133895,Apos Brno
174,Sociální služby města Pardubic,24406731,75090970,12.10.2023,"96 350,00 CZK",,"Objednávka - prostěradla, overaly, podložky - DpS U Kostelíčka","[{'název': 'Elastické prostěradlo obálkového střihu krémové', 'množství': 190, 'cena bez DPH': 390.45, 'cena s DPH': None}, {'název': 'Podložka na křesla 45x45 cm hnědá', 'množství': 14, 'cena bez DPH': 324.9, 'cena s DPH': None}, {'název': 'Kea] se zipy v rozkroku i na zádech koral, dlruk, M', 'množství': 4, 'cena bez DPH': 1757.5, 'cena s DPH': None}, {'název': 'Kea] se zipy v rozkroku i na zádech cmodř, dlruk, XL', 'množství': 6, 'cena bez DPH': 1757.5, 'cena s DPH': None}]",26131519,Apos Brno
175,"Centrum sociálních služeb Znojmo, příspěvková organizace",24390207,45671770,16.10.2023,,"120 775,00 CZK","Kupní smlouva - elastické prostěradlo obálkového střihu, elastické prostěradlo SMART","[{'název': 'elastické prostěradlo obálkové šedá', 'množství': 20, 'cena bez DPH': None, 'cena s dph': None}, {'název': 'elastické prostěradlo SMART meruňka', 'množství': 5, 'cena bez DPH': None, 'cena s dph': None}]",26114111,Apos Brno
176,Domov sociálních služeb Skřivany,24380923,578991,16.10.2023,"81 854,00 CZK","99 043,20 CZK",Dodávka ložního prádla,"[{'název': 'Bavlněné povlečení - Kvítí na šedém s níť. knoflíky', 'množství': 28, 'cena bez DPH': 538.51, 'cena s dph': 651.6}, {'název': 'Bavlněné povlečení - Slezsko šedé s níť. knoflíky', 'množství': 96, 'cena bez DPH': 538.51, 'cena s dph': 651.6}, {'název': 'Bavlněné povlečení - Podzim purporový s níť. knoflíky', 'množství': 4, 'cena bez DPH': 538.51, 'cena s dph': 651.6}, {'název': 'Bavlněné povlečení - Kvítí na bílém mentol s níť. knoflíky', 'množství': 24, 'cena bez DPH': 538.51, 'cena s dph': 651.6}]",26104255,Apos Brno
177,"Domov pro seniory Červenka, příspěvková organizace",24361515,75004402,13.10.2023,"79 200,89 CZK","95 833,00 CZK","Dodávka textilních výrobků, polštářů, podložek a pytlů.","[{'název': 'Plněný polštář Standard', 'množství': 20, 'cena bez DPH': None, 'cena s dph': 8708.85}, {'název': 'Prošívanbá přikrývka Standard', 'množství': 25, 'cena bez DPH': None, 'cena s dph': 20733.41}, {'název': 'Podložka Sonoma', 'množství': 30, 'cena bez DPH': None, 'cena s dph': 18274.51}, {'název': 'Elastický potah', 'množství': 30, 'cena bez DPH': None, 'cena s dph': 37464.5}, {'název': 'Nepromokavý pytel', 'množství': 15, 'cena bez DPH': None, 'cena s dph': 10651.33}]",26084243,Apos Brno
178,"Nemocnice Jablonec nad Nisou, p.o.",24315611,829838,09.10.2023,"201 139,67 CZK",,Objednávka operačního oblečení.,"[{'název': 'Operační oblečení dle cenové nabídky č. VN23494', 'množství': 1, 'cena bez DPH': '201139.67 Kč', 'cena s DPH': '201139.67 Kč'}]",26035715,Apos Brno
179,Domov se zvláštním režimem Krásná Lípa,24274127,70872741,02.10.2023,"80 701,65 CZK","97 649,00 CZK","Objednávka (smlouva) ""Prostěradla eleastická, přikrývky prošívané, polštáře, Čelakovského 40/13, Krásná Lípa, 407 46"".","[{'název': 'prostěradla elastická', 'množství': 130, 'cena bez DPH': None, 'cena s DPH': None}, {'název': 'přikrývky prošívané LUXUS', 'množství': 20, 'cena bez DPH': None, 'cena s DPH': None}, {'název': 'polštáře LUXUS COMFORT', 'množství': 20, 'cena bez DPH': None, 'cena s DPH': None}]",25992167,Apos Brno
