,Odběratel,ID,IČO,Datum uzavření smlouvy,Cena_bez_dph,Cena_s_dph,Předmět smlouvy,zboží,ID verze,Dodavatel
25,"CENTRUM ROŽMITÁL POD TŘEMŠÍNEM, poskytovatel sociálních služeb",17202515,42727219,22.11.2021,"84 200,00 CZK","101 882,00 CZK",nákup prádla,"[{'název': 'prostěradlo do gumy 90 x 200 x 30', 'množství': 150, 'cena bez DPH': None, 'cena s DPH': None}, {'název': 'polštář Mikra 70 x 90', 'množství': 20, 'cena bez DPH': None, 'cena s DPH': None}, {'název': 'přikrývka Mikra 140 x 200', 'množství': 20, 'cena bez DPH': None, 'cena s DPH': None}, {'název': 'prostěradlo 150 x 260', 'množství': 150, 'cena bez DPH': None, 'cena s DPH': None}]",18513383,Sc professional
26,"Vojenské lesy a statky ČR, s.p.",17200411,205,24.11.2021,"147 500,00 CZK",,"Polštáře, přikrývky, povlečení, ručníky, osušky, utěrky - Resort Olšina","[{'název': 'Přikrývka 140x200 cm', 'množství': 60, 'cena bez DPH': 580, 'cena s DPH': None}, {'název': 'Polštář 70x90 cm', 'množství': 60, 'cena bez DPH': 380, 'cena s DPH': None}, {'název': 'Polštář 50x70 cm', 'množství': 30, 'cena bez DPH': 270, 'cena s DPH': None}, {'název': 'Ložní souprava 1+1', 'množství': 100, 'cena bez DPH': 500, 'cena s DPH': None}, {'název': 'Frote rucník 50x100cm', 'množství': 150, 'cena bez DPH': 62, 'cena s DPH': None}, {'název': 'Frote osuška 70x140cm', 'množství': 150, 'cena bez DPH': 120, 'cena s DPH': None}, {'název': 'Vaflový rucník', 'množství': 100, 'cena bez DPH': 34, 'cena s DPH': None}, {'název': 'Utěrka', 'množství': 50, 'cena bez DPH': 22, 'cena s DPH': None}]",18511067,Sc professional
27,Domov pro seniory Chýnov,17170935,75011204,24.11.2021,,"85 317,10 CZK","Objednávka č. 308/2021 týkající se nákupu prádla (ložní soupravy, prostěradla, bryndáky, přikrývky, polštáře, deky)","[{'název': 'Ložní souprava Damašek GRAZ b. GOLD 1+1 (140x205;70x90) spr.', 'množství': 1, 'cena bez DPH': 641.3, 'cena s DPH': 38478.0}, {'název': 'Prostěradlo Jersey+Lycra s gumou 90x200x30', 'množství': 1, 'cena bez DPH': 344.85, 'cena s DPH': 6897.0}, {'název': 'Bryndák nepropustný vzorovaný', 'množství': 1, 'cena bez DPH': 254.1, 'cena s DPH': 10164.0}, {'název': 'Přikrývka MIKRA 140x200 cm', 'množství': 1, 'cena bez DPH': 701.8, 'cena s DPH': 7018.0}, {'název': 'Polštář MIKRA 70x90 cm', 'množství': 1, 'cena bez DPH': 459.8, 'cena s DPH': 13794.0}, {'název': 'Fleecová deka 150x200 cm', 'množství': 1, 'cena bez DPH': 344.85, 'cena s DPH': 8966.1}]",18479919,Sc professional
28,"Sociální služby Vsetín, příspěvková organizace",17123231,49562827,19.11.2021,"59 880,00 CZK",,"dodávka přikrývek,polštářů,ložních souprav","[{'název': 'přikrývka MIKRA 140x200cm', 'množství': 40, 'cena bez DPH': 490, 'cena s DPH': 592.9}, {'název': 'polštář MIKRA 70x90cm', 'množství': 40, 'cena bez DPH': 335, 'cena s DPH': 405.35}, {'název': 'ložní souprava Blake', 'množství': 23, 'cena bez DPH': 420, 'cena s DPH': 508.2}, {'název': 'ložní souprava Sektrum modrá', 'množství': 17, 'cena bez DPH': 420, 'cena s DPH': 508.2}, {'název': 'ložní souprava Spektrum fialová', 'množství': 9, 'cena bez DPH': 420, 'cena s DPH': 508.2}, {'název': 'ložní souprava Hippi fialová', 'množství': 5, 'cena bez DPH': 420, 'cena s DPH': 508.2}, {'název': 'ložní souprava Šachmot modrý', 'množství': 10, 'cena bez DPH': 420, 'cena s DPH': 508.2}]",18430187,Sc professional
29,"Domov pro seniory Hvízdal České Budějovice, příspěvková organizace",17103087,666238,11.06.2021,,"200 000,00 CZK","Textil: ložní, ručníky, osušky, podložky, žínky","[{'název': 'máslo', 'množství': 2, 'cena bez DPH': 25, 'cena s DPH': 30.5}, {'název': 'mléko', 'množství': 1, 'cena bez DPH': 15, 'cena s DPH': 18.3}]",18409203,Sc professional
30,"Domov pro seniory Hvízdal České Budějovice, příspěvková organizace",17103079,666238,23.08.2021,,"165 000,00 CZK","Textil - ručníky, žínky, ložní prádlo, osušky, prostěradla","[{'název': 'máslo', 'množství': 2, 'cena bez DPH': 25, 'cena s dph': 30.5}, {'název': 'mléko', 'množství': 1, 'cena bez DPH': 15, 'cena s dph': 18.3}]",18409195,Sc professional
31,"Psychiatrická léčebna Petrohrad, příspěvková organizace",14911395,829137,29.03.2021,"135 000,00 CZK","163 350,00 CZK",Dodávka ložního prádla,"[{'název': 'Ložní souprava (1+1)', 'množství': 300, 'cena bez DPH': 450, 'cena s DPH': 163350}]",16045047,Sc professional
32,Úřad práce ČR - krajská pobočka v Plzni - kontaktní pracoviště Plzeň-město (Úřad práce České republiky),14671003,72496991,05.03.2021,,,DODATEK Č. 2 k dohodě o poskytnutí příspěvku z cíleného programu Antivirus č. DOA-CO-1022473/2020 ze dne 22. 5. 2020,"[{'název': 'příspěvek', 'množství': None, 'cena bez DPH': None, 'cena s DPH': None}]",15762791,Sc professional
33,Palata - Domov pro zrakově postižené,9901724,70872783,05.11.2019,"84 750,00 CZK","102 547,00 CZK",objednávka - ložní prádlo,"[{'název': 'Ložní souprava 1+1 KREP, 100% bavlna, měkčené provedení', 'množství': 120, 'cena bez DPH': 475.0, 'cena s DPH': 57000.0}, {'název': 'Návlek na polštář 70x90cm KREP', 'množství': 40, 'cena bez DPH': 110.0, 'cena s DPH': 4400.0}, {'název': 'Prostěradlo Jersy+Lycra 90x200x30cm', 'množství': 80, 'cena bez DPH': 278.0, 'cena s DPH': 22240.0}, {'název': 'Frote ručník 50x100cm bavlna', 'množství': 15, 'cena bez DPH': 74.0, 'cena s DPH': 1110.0}]",15746747,Sc professional
34,Úřad práce ČR - krajská pobočka v Plzni - kontaktní pracoviště Plzeň-město (Úřad práce České republiky),14628399,72496991,04.03.2021,,,DODATEK k dohodě o poskytnutí příspěvku z cíleného programu Antivirus č. DOA-CO-1022473/2020 ze dne 22. 5. 2020,"[{'název': 'DODATEK', 'množství': None, 'cena bez DPH': None, 'cena s DPH': None}, {'název': 'Režim A plus', 'množství': None, 'cena bez DPH': None, 'cena s DPH': None}, {'název': 'Nucené omezení provozu', 'množství': None, 'cena bez DPH': None, 'cena s DPH': None}, {'název': '100 % náhrady mzdy', 'množství': None, 'cena bez DPH': None, 'cena s DPH': None}, {'název': 'Oznámení o poskytnuté podpoře', 'množství': None, 'cena bez DPH': None, 'cena s DPH': None}]",15711119,Sc professional
35,"Psychiatrická léčebna Petrohrad, příspěvková organizace",13696785,829137,01.12.2020,"211 640,00 CZK","256 084,40 CZK","Kupní smlouva na dodávku ložního prádla, matrací, ručníků a podložek","[{'název': 'Froté ručník', 'množství': 300, 'cena bez DPH': 23400, 'cena s DPH': 28314}, {'název': 'Prostěradlo plátno', 'množství': 250, 'cena bez DPH': 40000, 'cena s DPH': 48400}, {'název': 'Vypínací prostěradlo', 'množství': 100, 'cena bez DPH': 26000, 'cena s DPH': 31460}, {'název': 'Matrace rozměr 90x200x15 cm', 'množství': 20, 'cena bez DPH': 70000, 'cena s DPH': 84700}, {'název': 'Nepropustné návleky na polštáře', 'množství': 20, 'cena bez DPH': 6840, 'cena s DPH': 8276.4}, {'název': 'Nepropustné návleky na přikrývky', 'množství': 20, 'cena bez DPH': 21800, 'cena s DPH': 26378}, {'název': 'Absorpční pratelná podložka pro ochranu lůžka při inkontinenci', 'množství': 20, 'cena bez DPH': 8000, 'cena s DPH': 9680}, {'název': 'Mikrofaserová deka', 'množství': 20, 'cena bez DPH': 6000, 'cena s DPH': 7260}]",14702577,Sc professional
36,Palata - Domov pro zrakově postižené,13289724,70872783,22.10.2020,,"66 773,00 CZK",objednávka - textil,"[{'název': 'Ložní souprava 1+1 KREP, 100% bavlna, měkčené provedení', 'množství': 75, 'cena bez DPH': 475.0, 'cena s DPH': 35625.0}, {'název': 'Návlek na polštář 70x90cm KREP', 'množství': 90, 'cena bez DPH': 110.0, 'cena s DPH': 9900.0}, {'název': 'Froté žínka 15x20, kapsová, oranžová', 'množství': 60, 'cena bez DPH': 22.0, 'cena s DPH': 1320.0}, {'název': 'Froté prostěradlo 90x200x30', 'množství': 30, 'cena bez DPH': 278.0, 'cena s DPH': 8340.0}]",14245344,Sc professional
37,"Centrum sociálních služeb Domažlice, příspěvková organizace",12851604,75007754,11.09.2020,"80 500,00 CZK","97 405,00 CZK",200 ks absorpčních podložek,"[{'název': 'nepropustné absorpční podložky R základní 75 x 90', 'množství': 100, 'cena bez DPH': 375.0, 'cena s DPH': 453.75}, {'název': 'nepropustné absorpční podložky L s fixačními křidélky 75 x 90', 'množství': 100, 'cena bez DPH': 430.0, 'cena s DPH': 520.3}, {'název': 'celkové objednané zboží', 'množství': None, 'cena bez DPH': 80500.0, 'cena s DPH': 97405.0}]",13782340,Sc professional
38,"Centrum sociálních služeb Domažlice, příspěvková organizace",12536432,75007754,03.08.2020,"80 500,00 CZK","97 405,00 CZK",absorpční podložky,"[{'název': 'nepropustné absorpční podložky R základní 75 x 90', 'množství': 100, 'cena bez DPH': 375.0, 'cena s DPH': 453.75}, {'název': 'nepropustné absorpční podložky L s fixačními křidélky 75 x 90', 'množství': 100, 'cena bez DPH': 430.0, 'cena s DPH': 520.3}]",13449796,Sc professional
39,Úřad práce ČR - krajská pobočka v Plzni - kontaktní pracoviště Plzeň-město (Úřad práce České republiky),11898308,72496991,25.05.2020,,,DOHODA o poskytnutí příspěvku z cíleného programu Antivirus č. DOA-CO-1022473/2020,"[{'název': 'Antivirus', 'množství': None, 'cena bez DPH': None, 'cena s DPH': None}]",12776044,Sc professional
40,"Domov pro seniory Havlíčkův Brod, příspěvková organizace",10051636,60128071,20.11.2019,"48 000,00 CZK","58 080,00 CZK",dodávka 150 ks bavlněných ložních souprav 1+1,"[{'název': 'ložní souprava 1+1 (140x200cm) + (70x90cm) knoflíkový uzávěr, materiál 100% bavlna cca 150g/m2', 'množství': 150, 'cena bez DPH': 320, 'cena s DPH': 387.2}, {'název': 'dodávka zboží', 'množství': None, 'cena bez DPH': 48000, 'cena s DPH': 58080}]",10811800,Sc professional
41,Domov pro seniory Chýnov,9906828,75011204,04.11.2019,"80 372,00 CZK","97 250,00 CZK",Objednávka 310/2019,"[{'název': 'Ložní souprava se zapošitím', 'množství': None, 'cena bez DPH': None, 'cena s DPH': 150.0}, {'název': 'Prostěradlo typu obálka', 'množství': 70, 'cena bez DPH': 410.0, 'cena s DPH': 28700.0}, {'název': 'Nepromokavá podložka s úchyty', 'množství': 40, 'cena bez DPH': 500.0, 'cena s DPH': 20000.0}, {'název': 'Nepropustné bryndáky', 'množství': 40, 'cena bez DPH': 260.0, 'cena s DPH': 10400.0}]",10656232,Sc professional
42,Domov důchodců Dobrá Voda,9877808,666262,04.11.2019,,"64 432,50 CZK",Objednávka - č. 614/2019 - prostěradlo vypínací jersey + lycra (guma v tunýlku) - 250 ks,"[{'název': 'prostěradlo vypínací jersey+lycra (guma v tunýlku) 90x200x25 cm (bílá barva)', 'množství': None, 'cena bez DPH': None, 'cena s dph': '250,00 Kč'}]",10625476,Sc professional
43,"Centrum sociálních služeb Domažlice, příspěvková organizace",8924003,75007754,04.07.2019,"80 500,00 CZK","97 405,00 CZK",dodávka nepropustných absorpčních podložek,"[{'název': 'nepropustné absorpční podložky (základní typ)', 'množství': 100, 'cena bez DPH': 454, 'cena s DPH': None}, {'název': 'nepropustné absorpční podložky (s křidélky)', 'množství': 100, 'cena bez DPH': 520, 'cena s DPH': None}]",9615691,Sc professional
44,Domov Zvíkovecká kytička,8471471,70887195,26.04.2019,"98 800,00 CZK","119 548,00 CZK",Objednávka ložních souprav,"[{'název': 'NÁHRADNÍ PLNĚNÍ', 'množství': 200, 'cena bez DPH': None, 'cena s dph': None}]",9137619,Sc professional
45,Domov Zvíkovecká kytička,7313291,70887195,18.12.2018,"105 450,00 CZK","127 595,00 CZK",Nákup prádla pro klienty,"[{'název': '102018', 'množství': None, 'cena bez DPH': None, 'cena s DPH': None}]",7895931,Sc professional
46,"Horské lázně Karlova Studánka, státní podnik",7246511,14450216,07.12.2018,"74 212,00 CZK",,DODÁVKA PŘIKRÝVEK A POLŠTÁŘŮ,"[{'název': 'PŘIKRYVKA MARS', 'množství': 148, 'cena bez DPH': 421.0, 'cena s DPH': 508.41}, {'název': 'POLŠTÁŘ PROŠITÝ', 'množství': 32, 'cena bez DPH': 372.0, 'cena s DPH': 450.12}]",7824291,Sc professional
47,Domov pro seniory Háje,7119667,70875111,19.12.2018,,"194 471,20 CZK",Objednávka ložních souprav,"[{'název': 'máslo', 'množství': 2, 'cena bez DPH': 25, 'cena s DPH': 30.5}, {'název': 'mléko', 'množství': 1, 'cena bez DPH': 15, 'cena s DPH': 18.3}]",7687379,Sc professional
48,"Domov pro seniory Nopova,příspěvková organizace",6804167,70887314,08.12.2017,"142 931,00 CZK","142 931,00 CZK",Dodávka přehozů na postele,"[{'název': 'přehozy na lůžka', 'množství': 225, 'cena bez DPH': 142931, 'cena s DPH': 142931}]",7348711,Sc professional
49,"Centrum sociálních služeb Domažlice, příspěvková organizace",6634875,75007754,29.10.2018,"80 500,00 CZK","97 405,00 CZK",200 ks absorpčních podložek,"[{'název': 'Absorpční podložky R - základní', 'množství': 100, 'cena bez DPH': 453.75, 'cena s DPH': 453.75}, {'název': 'Absorpční podložky L - s fixačními křidélky', 'množství': 100, 'cena bez DPH': 520.3, 'cena s DPH': 520.3}]",7166915,Sc professional
50,"Domov pro seniory Hvízdal České Budějovice, příspěvková organizace",4829640,666238,10.04.2018,,"116 160,00 CZK",Dodávka bavlněného ložního povlečení,"[{'název': 'bavlněné ložní povlečení se zapínáním na knoflíky', 'množství': 300, 'cena bez DPH': None, 'cena s DPH': 116160.0}]",5207892,Sc professional
51,Domov pro seniory Háje,4014520,70875111,16.12.2017,"56 000,00 CZK",,Dodávka pratelných absorpčních podložek,"[{'název': 'máslo', 'množství': 2, 'cena bez DPH': 25, 'cena s DPH': 30.5}, {'název': 'mléko', 'množství': 1, 'cena bez DPH': 15, 'cena s DPH': 18.3}]",4322700,Sc professional
52,Domov Zvíkovecká kytička,4007172,70887195,26.09.2017,"137 100,00 CZK","165 891,00 CZK",Nákup ložního prádla,"[{'název': 'prostěradlo bílé 170 x 270 cm', 'množství': 300, 'cena bez DPH': 202.0, 'cena s DPH': 244.42}, {'název': 'ložní souprava bílá polštář + přikrývka s hotelovým uzávěrem', 'množství': 150, 'cena bez DPH': 510.0, 'cena s DPH': 616.1}]",4313372,Sc professional
53,"Domov důchodců Velké Hamry, příspěvková organizace",3606988,71220003,20.11.2017,"63 215,00 CZK","76 490,00 CZK",Objednávka - ložní soupravy,"[{'název': 'Ložní souprava krep 1+1', 'množství': 133, 'cena bez DPH': 475.0, 'cena s DPH': 631.75}, {'název': 'Návlek polštář krep', 'množství': 40, 'cena bez DPH': 1.0, 'cena s DPH': 40.0}]",3890776,Sc professional
54,Palata - Domov pro zrakově postižené,3411652,70872783,01.11.2017,,"94 072,66 CZK",Objednávka,"[{'název': 'Utěrka - otatno', 'množství': 20, 'cena bez DPH': 22.0, 'cena s DPH': 26.62}, {'název': 'Utěrka SUPER', 'množství': 6, 'cena bez DPH': 41.0, 'cena s DPH': 49.61}, {'název': 'Frote ručník', 'množství': 20, 'cena bez DPH': 32.0, 'cena s DPH': 38.72}, {'název': 'Prostěradlo - plátno', 'množství': 30, 'cena bez DPH': 100.0, 'cena s DPH': 121.0}, {'název': 'Ložní souprava', 'množství': 100, 'cena bez DPH': 475.0, 'cena s DPH': 574.75}, {'název': 'Návle - polštář', 'množství': 40, 'cena bez DPH': 98.0, 'cena s DPH': 118.58}, {'název': 'Frote prostěradlo', 'množství': 100, 'cena bez DPH': 220.0, 'cena s DPH': 266.2}]",3679068,Sc professional
55,Domov Libníč a Centrum sociálních služeb Empatie,2758474,666271,23.08.2017,,"121 358,16 CZK",Objednávka ložního prádla,"[{'název': 'máslo', 'množství': 2, 'cena bez DPH': 25, 'cena s dph': 30.5}, {'název': 'mléko', 'množství': 1, 'cena bez DPH': 15, 'cena s dph': 18.3}]",2968670,Sc professional
56,"Domov pro seniory Hvízdal České Budějovice, příspěvková organizace",1954870,666238,02.06.2017,,"116 160,00 CZK",dodávka bavlněného ložního povlečení,"[{'název': 'máslo', 'množství': 1, 'cena bez DPH': 25, 'cena s DPH': 30.25}, {'název': 'mléko', 'množství': 2, 'cena bez DPH': 15, 'cena s DPH': 18.3}]",2107882,Sc professional
57,Domov Zvíkovecká kytička,1342766,70887195,11.07.2016,"62 700,00 CZK","75 867,00 CZK",Nákup ložního prádla,"[{'název': 'polštář 70x90 cm', 'množství': 50, 'cena bez DPH': 100.4, 'cena s DPH': None}, {'název': 'přikrývka 140x200 cm', 'množství': 50, 'cena bez DPH': 46400, 'cena s DPH': None}, {'název': 'obdélníkový podsedák nepropustný - barva hnědá', 'množství': 50, 'cena bez DPH': 63004, 'cena s DPH': None}, {'název': 'froté prostěradlo na jednolůžko', 'množství': 50, 'cena bez DPH': 240, 'cena s DPH': None}]",1448258,Sc professional
58,Domov pro seniory Nová slunečnice,812813,71294287,19.12.2016,"225 300,00 CZK","272 613,00 CZK",Ložní textilie,"[{'název': 'Ložní textilie: Prostěradla', 'množství': 300, 'cena bez DPH': 225300.0, 'cena s DPH': 272613.0}, {'název': 'Ložní textilie: ložní soupravy', 'množství': 540, 'cena bez DPH': None, 'cena s DPH': None}]",865009,Sc professional
59,"Domov pro seniory Nopova,příspěvková organizace",803969,70887314,15.12.2016,"63 700,00 CZK","77 077,00 CZK",Nákup přikrývek a polštářů.,"[{'název': 'Přikývka WASH 135x200 cm', 'množství': 70, 'cena bez DPH': 910, 'cena s DPH': 1100}, {'název': 'Polštář 70x90 cm', 'množství': 70, 'cena bez DPH': 910, 'cena s DPH': 1100}]",855733,Sc professional
60,Palata Domov pro zrakově postižené,748209,70872783,02.12.2016,,"160 446,00 CZK",kupní smlouva,"[{'název': 'Polštář MIKRA 70 x 90 cm', 'množství': 136, 'cena bez DPH': 360, 'cena s dph': None}, {'název': 'Ložní soupravy krep 1+1 (140 x 200 +70 x 90 cm)', 'množství': 136, 'cena bez DPH': 395, 'cena s dph': None}, {'název': 'Froté prostěradlo 100 x 200 x 25 cm', 'množství': 136, 'cena bez DPH': 220, 'cena s dph': None}]",795461,Sc professional
61,Vojenská lázeňská a rekreační zařízení,408561,582,10.10.2016,"68 510,00 CZK",,"Ubrusy,Ručníky,povlaky na polštář","[{'název': 'Ubrus barevný - barva vínová damaškový 130/170cm', 'množství': None, 'cena bez DPH': '500,00', 'cena s DPH': None}, {'název': 'Napron - vícebarevný (vínový) polyester s teflonovou úpravou 90x90', 'množství': None, 'cena bez DPH': '200,00', 'cena s DPH': None}, {'název': 'Ručník froté barevný LOSOSOVÝ hladký s tenkými proužky (nestahující se bordura) - 50x100 450g/m2', 'množství': None, 'cena bez DPH': '83,00', 'cena s DPH': None}, {'název': 'Povlak na polštář - barva bílá 70x90 atlas gradl (proužek 2cm) hotelový uzávěr', 'množství': None, 'cena bez DPH': '78,00', 'cena s DPH': None}]",435073,Sc professional
0,Ústřední vojenská nemocnice - Vojenská fakultní nemocnice Praha,29418248,61383082,16.12.2024,"70 800,00 CZK",,OBJ-SVM2401543,"[{'název': 'PROSTĚRADLO napínací jersey 100 x 200 cm /zelené', 'množství': None, 'cena bez DPH': None, 'cena s DPH': None}]",31433004,Lutema care
1,"Domov Březiny, příspěvková organizace",29160744,847348,27.11.2024,"388 541,17 CZK","470 135,82 CZK",Objednávka ložního prádla č.100/2024,"[{'název': 'Povlak na peřinu 140x200cm na knoflíky tisk', 'množství': 154, 'cena bez DPH': None, 'cena s DPH': 796.18}, {'název': 'Povlak na polštář 70x90cm na knoflíky tisk', 'množství': 154, 'cena bez DPH': None, 'cena s DPH': 227.48}, {'název': 'Inkontinenční podložka 75x90cm bez záložky', 'množství': 154, 'cena bez DPH': None, 'cena s DPH': 411.4}, {'název': 'Polštář 70x90cm/náplň kuličky/90 stupňů', 'množství': 154, 'cena bez DPH': None, 'cena s DPH': 364.21}, {'název': 'Peřina 135x200cm praní 95 stupňů', 'množství': 154, 'cena bez DPH': None, 'cena s DPH': 594.11}, {'název': 'Deka uni beránek/mikro 140x200cm', 'množství': 154, 'cena bez DPH': None, 'cena s DPH': 659.45}]",31163000,Lutema care
2,Ústřední vojenská nemocnice - Vojenská fakultní nemocnice Praha,29122628,61383082,25.11.2024,"108 900,00 CZK",,OBJ-SVM2401409,"[{'název': 'POVLAK na polštář 70 x 90 cm /zelený', 'množství': None, 'cena bez DPH': None, 'cena s DPH': None}, {'název': 'POVLAK na přikrývku 140 x 200 cm /zelený', 'množství': None, 'cena bez DPH': None, 'cena s DPH': None}]",31122192,Lutema care
3,Ústřední vojenská nemocnice - Vojenská fakultní nemocnice Praha,29081436,61383082,21.11.2024,"38 200,00 CZK",,OBJ-SVM2401356,"[{'název': 'PROSTĚRADLO 145 x 200 cm /bílé', 'množství': None, 'cena bez DPH': 38200, 'cena s DPH': 46222}]",31078924,Lutema care
4,"Domov Březiny, příspěvková organizace",28748224,847348,29.10.2024,"101 330,00 CZK","122 609,30 CZK",Nákup ložního prádla a lůžkovin,"[{'název': 'Utěrka 50x70cm, praní na 90 stupňů', 'množství': 30, 'cena bez DPH': None, 'cena s dph': 47.19}]",30728624,Lutema care
5,Ústřední vojenská nemocnice - Vojenská fakultní nemocnice Praha,28453840,61383082,03.10.2024,"108 900,00 CZK",,OBJ-SVM2401157,"[{'název': 'POVLAK na polštář 70 x 90 cm /zelený', 'množství': None, 'cena bez DPH': None, 'cena s dph': None}, {'název': 'POVLAK na přikrývku 140 x 200 cm /zelený', 'množství': None, 'cena bez DPH': None, 'cena s dph': None}]",30401744,Lutema care
6,"Domov seniorů Hranice, příspěvková organizace",28330224,70876541,04.09.2024,"81 400,00 CZK","98 494,00 CZK",objednávka - inkontinenční podložka - 200 ks,"[{'název': 'inkontinenční podložka', 'množství': 200, 'cena bez DPH': None, 'cena s dph': None}]",30272796,Lutema care
7,Ústřední vojenská nemocnice - Vojenská fakultní nemocnice Praha,28054904,61383082,02.09.2024,"108 900,00 CZK",,OBJ-SVM2401045,"[{'název': 'POVLAK na polštář 70 x 90 cm /zelený', 'množství': None, 'cena bez DPH': None, 'cena s DPH': None}, {'název': 'POVLAK na přikrývku 140 x 200 cm /zelený', 'množství': None, 'cena bez DPH': None, 'cena s DPH': None}]",29983892,Lutema care
8,Ústřední vojenská nemocnice - Vojenská fakultní nemocnice Praha,27914396,61383082,18.08.2024,"179 700,00 CZK",,OBJ-SVM2400931,"[{'název': 'POVLAK na polštář 70 x 90 cm /zelený', 'množství': None, 'cena bez DPH': None, 'cena s DPH': None}, {'název': 'POVLAK na přikrývku 140 x 200 cm /zelený', 'množství': None, 'cena bez DPH': None, 'cena s DPH': None}, {'název': 'PROSTĚRADLO napínací jersey 100 x 200 cm /zelené', 'množství': None, 'cena bez DPH': None, 'cena s DPH': None}]",29836444,Lutema care
9,Ústřední vojenská nemocnice - Vojenská fakultní nemocnice Praha,27797820,61383082,06.08.2024,"99 120,00 CZK",,OBJ-SVM2400859,"[{'název': 'PROSTĚRADLO napínací jersey 100 x 200 cm /zelené', 'množství': None, 'cena bez DPH': None, 'cena s DPH': None}, {'název': 'PROSTĚRADLO napínací jersey 100 x 200 cm /žluté', 'množství': None, 'cena bez DPH': None, 'cena s DPH': None}]",29713352,Lutema care
10,Ústřední vojenská nemocnice - Vojenská fakultní nemocnice Praha,27345564,61383082,24.06.2024,"108 900,00 CZK",,OBJ-SVM2400766,"[{'název': 'POVLAK na polštář 70 x 90 cm /zelený', 'množství': None, 'cena bez DPH': None, 'cena s DPH': None}, {'název': 'POVLAK na přikrývku 140 x 200 cm /zelený', 'množství': None, 'cena bez DPH': None, 'cena s DPH': None}]",29237580,Lutema care
11,Ústřední vojenská nemocnice - Vojenská fakultní nemocnice Praha,26764239,61383082,06.05.2024,"2 525 222,00 CZK",,Kupní - ostatní smlouvy,"[{'název': 'ložní prádlo', 'množství': None, 'cena bez DPH': None, 'cena s DPH': None}]",28633499,Lutema care
12,"Domov Magnolie, Ostrava-Vítkovice, příspěvková organizace",25392515,70631859,28.12.2023,,"112 506,77 CZK",Objednávka - inkontinenční podložky,"[{'název': 'Podložka inkontinenční podštitá', 'množství': 132, 'cena bez DPH': 704.4, 'cena s dph': None}]",27192471,Lutema care
13,"Domov Magnolie, Ostrava-Vítkovice, příspěvková organizace",25392227,70631859,28.12.2023,,"440 000,00 CZK",Objednávka - ochranné pracovní pomůcky,"[{'název': 'Kalhoty pánské PETR bílé', 'množství': 25, 'cena bez DPH': None, 'cena s dph': None}]",27192167,Lutema care
14,"Domov Magnolie, Ostrava-Vítkovice, příspěvková organizace",25303463,70631859,20.12.2023,,"96 681,42 CZK",Objednávka - povlakyy na peřiny a polštáře,"[{'název': 'Povlak na peřinu 140x200cm', 'množství': 135, 'cena bez DPH': None, 'cena s dph': None}, {'název': 'Povlak na polštář 70x90cm', 'množství': 138, 'cena bez DPH': None, 'cena s dph': None}]",27098259,Lutema care
